<?xml version="1.0" encoding="UTF-8"?>
<!DOCTYPE orderOverview SYSTEM "../dtd/ordersDtd.dtd">

<orderOverview title="All the orders">
    <order orderID="OR003" timeStamp="2023-10-26 13:17:45">
        <customer name="Lars" surname="Zieger" isStudent="yes">
            <student>
                <matrikelNo>4531095</matrikelNo>
                <placeOfStudy country="germany">DHBW Karlsruhe</placeOfStudy>
            </student>
        </customer>
        <address>
            <street>Teststraße</street>
            <houseNo>12</houseNo>
            <postalCode>32145</postalCode>
            <city>Testhausen</city>
        </address>
        <pizza pizzaID="PZ001" size="30cm">
            <topping>
                <cheese>Käse</cheese>
                <mushrooms>Pilze</mushrooms>
                <nduja>Nduja</nduja>
                <olives>Oliven</olives>
                <arugola>Ruccola</arugola>
            </topping>
            <extraRequests></extraRequests>
        </pizza>
    </order>
</orderOverview>