<?xml version="1.0" encoding="UTF-8"?>
<!DOCTYPE orderOverview SYSTEM "../dtd/ordersDtd.dtd">

<orderOverview title="All the orders">
    <order orderID="OR001" timeStamp="2023-10-25 14:10:36">
        <customer name="Hermann" surname="Studymann" isStudent="yes">
            <student>
                <matrikelNo>41234567890</matrikelNo>
                <placeOfStudy country="germany">Karlsruhe</placeOfStudy>
            </student>
        </customer>
        <address>
            <street>Musterstraße</street>
            <houseNo>123</houseNo>
            <postalCode>12345</postalCode>
            <city>Musterstadt</city>
        </address>
        <pizza pizzaID="PZ001" size="30cm">
            <topping>
                <salami spicy="yes">Salami</salami>
                <ham>Schinken</ham>
                <cheese>Käse</cheese>
            </topping>
            <extraRequests>Bitte extra scharf</extraRequests>
        </pizza>
        <pizza pizzaID="PZ002" size="28cm">
            <topping>
                <salami spicy="no"></salami>
                <cheese>Käse</cheese>
                <mushrooms>Pilze</mushrooms>
            </topping>
            <extraRequests>Bitte keine Soße</extraRequests>
        </pizza>
        <pizza pizzaID="PZ003" size="46cm">
            <topping>
                <cheese>Käse</cheese>
                <mushrooms>Pilze</mushrooms>
                <mushrooms>Pilze</mushrooms>
            </topping>
            <extraRequests>Bitte extra viele Pilze</extraRequests>
        </pizza>
    </order>
</orderOverview>