<?xml version="1.0" encoding="UTF-8"?>
<!DOCTYPE orderOverview SYSTEM "../dtd/ordersDtd.dtd">

<orderOverview title="All the orders">
    <order orderID="OR002" timeStamp="2023-10-26 12:07:32">
        <customer name="Claudia" surname="Nonstudent" isStudent="no">
        </customer>
        <address>
            <street>Gerlindestraße</street>
            <houseNo>25</houseNo>
            <postalCode>32145</postalCode>
            <city>Ausdenkhausen</city>
        </address>
        <pizza pizzaID="PZ001" size="30cm">
            <topping>
                <salami spicy="yes"></salami>
                <ham>Schinken</ham>
                <cheese>Käse</cheese>
                <mushrooms>Pilze</mushrooms>
            </topping>
            <extraRequests>Könnte ich bitte noch Oliven haben, aber nur die grünen</extraRequests>
        </pizza>
    </order>
</orderOverview>